MCQ,Choices,Correct
What is the primary goal of Artificial Intelligence (AI) research?,a: Developing robots that can perform tasks | b: Creating machines that can think and learn like humans | c: Improving computer graphics | d: Enhancing software security,b
What is an example of a high-profile application of AI?,a: Virtual reality games | b: Autonomous vehicles | c: Web search engines | d: All of the above,d
What is Artificial General Intelligence (AGI)?,a: AI that can complete any cognitive task | b: AI that can only perform a limited set of tasks | c: AI that can only understand human language | d: AI that can only recognize images,a
Why did AI research experience a decline in funding and interest?,a: Due to advancements in AI techniques | b: Due to the lack of real-world applications | c: Due to the failure to meet expectations | d: Due to the loss of funding and lack of interest,c
What is the term for the rapid increase in speed that occurs as problems grow in size?,a: Combinatorial explosion | b: Algorithmic complexity | c: Exponential growth | d: Polynomial growth,a
What is a key challenge in AI research?,a: Creating machines that can think and learn like humans | b: Improving computer graphics | c: Accurate and efficient reasoning | d: Enhancing software security,c
